{
  "$schema": "../../Schemas/project_world_verify_baseline.schema.json",
  "schema_version": 1,
  "verify": "Project.World.Realization.Verify.Gameplay",
  "identity": {
    "producer_id": "project_gameplay_placement:v1",
    "output_revision": 1,
    "pipeline_revision": 1,
    "comparison_contract_version": 1,
    "engine_identity": "eab58750e84719489f3ee0d42d05a533ceb357eb3ee511777e9408d27a85f43c",
    "fixture_inputs": [
      {"name": "definition:ObjectDefinition:WaterBottle", "sha256": "1c8d9507ba6b84c9261e25c1f91edd3eb53bfe834e2fb58ed7d1e96fb7cca863"},
      {"name": "definition:ObjectDefinition:WaterBottleSmall", "sha256": "0a08e6cff943f4631a3f6c0b804324b944f6a2bbe0a3664801382a70fdfe04d3"},
      {"name": "file:Plugins/World/ProjectWorldTestData/Data/GameplayPlacement/synthetic_territory_twin.json", "sha256": "6735be13f9e13ddce975e1f0b45df1ba93082b2b4b38ff911bf96d3a53692f9e"},
      {"name": "memory:bundle", "sha256": "2d6e39372cfe2839a64bbd693aa863a22ac987826ad1534b20feaa9b162c8cc2"},
      {"name": "memory:profile", "sha256": "ebdd292fc58749877e87511d76c221eb10d1842953a18e64b5727de7a988abce"}
    ],
    "embedded": []
  },
  "projection_sha256": "09f485e871d1cd609d1e9c3da85aca072981c57986185177db4f9cb3a867af82",
  "records": [
    {
      "kind": "actor",
      "key": "gameplay:synthetic_water_01",
      "fields": {
        "applied_content_hash": "59E06FAE8A7418906887164B98174BF4",
        "applied_structure_hash": "25de7d41e0cc0931da2f71e9a15320c0",
        "auto_lod": "0",
        "class": "/Script/ProjectObject.InteractableActor",
        "component.DefaultRoot.attach_parent": "none",
        "component.DefaultRoot.class": "/Script/Engine.SceneComponent",
        "component.DefaultRoot.component_tags": "",
        "component.DefaultRoot.mobility": "Movable",
        "component.DefaultRoot.relative_transform": "t=250000,-250000,216532;r=0,0,0,1000000;s=100000,100000,100000",
        "component.PickupCapabilityComponent_0.class": "/Script/ProjectObjectCapabilities.PickupCapabilityComponent",
        "component.PickupCapabilityComponent_0.component_tags": "",
        "component.StaticMeshComponent_0.attach_parent": "DefaultRoot",
        "component.StaticMeshComponent_0.class": "/Script/Engine.StaticMeshComponent",
        "component.StaticMeshComponent_0.collision_enabled": "QueryAndPhysics",
        "component.StaticMeshComponent_0.collision_profile": "BlockAllDynamic",
        "component.StaticMeshComponent_0.component_tags": "DefMeshId=body",
        "component.StaticMeshComponent_0.materials": "/ProjectObject/HumanMade/Consumables/Vital/Nutrition/Drink/WaterBottle/MI_WaterBottle.MI_WaterBottle,/ProjectElement/HumanMade/Paint/MLI_Paint_Mate_Pure_Grey.MLI_Paint_Mate_Pure_Grey",
        "component.StaticMeshComponent_0.mesh": "/ProjectObject/HumanMade/Consumables/Vital/Nutrition/Drink/WaterBottle/SM_WaterBottle.SM_WaterBottle",
        "component.StaticMeshComponent_0.mobility": "Movable",
        "component.StaticMeshComponent_0.relative_transform": "t=0,0,0;r=0,0,0,1000000;s=100000,100000,100000",
        "components": "DefaultRoot,PickupCapabilityComponent_0,StaticMeshComponent_0",
        "data_id": "72df6e51-0daa-c424-b2fa-ae8d64988897",
        "definition_asset": "/ProjectObject/HumanMade/Consumables/Vital/Nutrition/Drink/WaterBottle/WaterBottle.WaterBottle",
        "definition_id": "ObjectDefinition:WaterBottle",
        "external_package": "1",
        "guid": "850875d4-96c3-cf1f-ab20-6a33981dcb81",
        "hlod_layer": "none",
        "label": "ProjectWorld Gameplay synthetic_water_01",
        "name": "ProjectWorld_Gameplay_synthetic_water_01",
        "root": "DefaultRoot",
        "spatially_loaded": "1",
        "tags": "ProjectWorld.Cell=grid_24b9032e5f87005d:x0:y0,ProjectWorld.GameplayDefinition=ObjectDefinition:WaterBottle,ProjectWorld.GameplayObject=synthetic_water_01,ProjectWorld.GameplayPlacement.v1,ProjectWorld.GameplaySemantic=90807220d00d8ec6422185ccf825402bd7d33e20cfa299fd5b7ce81e65f592e3,ProjectWorld.Generated.v1,ProjectWorld.Grid=grid_24b9032e5f87005d",
        "transform": "t=250000,-250000,216532;r=0,0,0,1000000;s=100000,100000,100000"
      }
    },
    {
      "kind": "actor",
      "key": "gameplay:synthetic_water_02",
      "fields": {
        "applied_content_hash": "58862F0D9E13FD51CF369167A5B74DB7",
        "applied_structure_hash": "25de7d41e0cc0931da2f71e9a15320c0",
        "auto_lod": "0",
        "class": "/Script/ProjectObject.InteractableActor",
        "component.DefaultRoot.attach_parent": "none",
        "component.DefaultRoot.class": "/Script/Engine.SceneComponent",
        "component.DefaultRoot.component_tags": "",
        "component.DefaultRoot.mobility": "Movable",
        "component.DefaultRoot.relative_transform": "t=900000,-250000,216849;r=0,0,707107,707107;s=100000,100000,100000",
        "component.PickupCapabilityComponent_0.class": "/Script/ProjectObjectCapabilities.PickupCapabilityComponent",
        "component.PickupCapabilityComponent_0.component_tags": "",
        "component.StaticMeshComponent_0.attach_parent": "DefaultRoot",
        "component.StaticMeshComponent_0.class": "/Script/Engine.StaticMeshComponent",
        "component.StaticMeshComponent_0.collision_enabled": "QueryAndPhysics",
        "component.StaticMeshComponent_0.collision_profile": "BlockAllDynamic",
        "component.StaticMeshComponent_0.component_tags": "DefMeshId=body",
        "component.StaticMeshComponent_0.materials": "/ProjectObject/HumanMade/Consumables/Vital/Nutrition/Drink/WaterBottle/MI_WaterBottle.MI_WaterBottle",
        "component.StaticMeshComponent_0.mesh": "/ProjectObject/HumanMade/Consumables/Vital/Nutrition/Drink/WaterBottle/SM_WaterBottleSmall.SM_WaterBottleSmall",
        "component.StaticMeshComponent_0.mobility": "Movable",
        "component.StaticMeshComponent_0.relative_transform": "t=0,0,0;r=0,0,0,1000000;s=100000,100000,100000",
        "components": "DefaultRoot,PickupCapabilityComponent_0,StaticMeshComponent_0",
        "data_id": "f6bc3ac6-1c8c-63e9-526c-728f0abed258",
        "definition_asset": "/ProjectObject/HumanMade/Consumables/Vital/Nutrition/Drink/WaterBottle/WaterBottleSmall.WaterBottleSmall",
        "definition_id": "ObjectDefinition:WaterBottleSmall",
        "external_package": "1",
        "guid": "d58f1893-e376-fbf7-8f60-4055469d1a34",
        "hlod_layer": "none",
        "label": "ProjectWorld Gameplay synthetic_water_02",
        "name": "ProjectWorld_Gameplay_synthetic_water_02",
        "root": "DefaultRoot",
        "spatially_loaded": "1",
        "tags": "ProjectWorld.Cell=grid_24b9032e5f87005d:x1:y0,ProjectWorld.GameplayDefinition=ObjectDefinition:WaterBottleSmall,ProjectWorld.GameplayObject=synthetic_water_02,ProjectWorld.GameplayPlacement.v1,ProjectWorld.GameplaySemantic=cc0faddc0a666afc891f2db7f6ac6455a3456ab6571ebe92494773d2f3e72f14,ProjectWorld.Generated.v1,ProjectWorld.Grid=grid_24b9032e5f87005d",
        "transform": "t=900000,-250000,216849;r=0,0,707107,707107;s=100000,100000,100000"
      }
    }
  ]
}
