{
  "$schema": "../../Schemas/project_world_verify_baseline.schema.json",
  "schema_version": 1,
  "verify": "Project.World.Realization.Verify.Road",
  "identity": {
    "producer_id": "project_road_mesh:v1",
    "output_revision": 2,
    "pipeline_revision": 1,
    "comparison_contract_version": 1,
    "engine_identity": "eab58750e84719489f3ee0d42d05a533ceb357eb3ee511777e9408d27a85f43c",
    "fixture_inputs": [
      {"name": "memory:bundle", "sha256": "ca055ef34ca2957f212dfde22f655ff84225c4b7d6230533ffd79534c0503cfa"},
      {"name": "memory:profile", "sha256": "670f7a1a6bf028271a63841a846ba37a83b20bfd4ccc075c7299958153023be8"},
      {"name": "object:/Engine/BasicShapes/BasicShapeMaterial.BasicShapeMaterial", "sha256": "e707d63439f5df802115c7c1693e64e47e708fb619e581a2af2e1651466eeaa4"}
    ],
    "embedded": []
  },
  "projection_sha256": "812b101ffd563d8d71cc444b91fbee26eaf0515d96964a73fb5421106ee64bc3",
  "records": [
    {
      "kind": "actor",
      "key": "road:cell_0",
      "fields": {
        "auto_lod": "0",
        "class": "/Script/Engine.StaticMeshActor",
        "component.affects_navigation": "0",
        "component.class": "/Script/Engine.StaticMeshComponent",
        "component.collision_enabled": "QueryAndPhysics",
        "component.collision_profile": "BlockAll",
        "component.mesh": "Cells/SM_ProjectWorldRoad_cell_0.SM_ProjectWorldRoad_cell_0",
        "component.mobility": "Static",
        "component.overlap_events": "0",
        "component.override_materials": "",
        "component.relative_transform": "t=0,-100000,0;r=0,0,0,1000000;s=100000,100000,100000",
        "external_package": "1",
        "guid": "2a71404a-3a58-0191-d57b-c1f699578747",
        "hlod_layer": "none",
        "label": "ProjectWorld Roads cell_0",
        "name": "ProjectWorld_Road_cell_0",
        "spatially_loaded": "1",
        "tags": "ProjectWorld.Generated.v1,ProjectWorld.Grid=road_grid,ProjectWorld.Road.v1,ProjectWorld.RoadCell=cell_0,ProjectWorld.RoadSemantic=5cbbaa413aa2c75e2df4e418e219502c9d9081e6fcd1966788a570187e65ae47",
        "transform": "t=0,-100000,0;r=0,0,0,1000000;s=100000,100000,100000"
      }
    },
    {
      "kind": "actor",
      "key": "road:cell_1",
      "fields": {
        "auto_lod": "0",
        "class": "/Script/Engine.StaticMeshActor",
        "component.affects_navigation": "0",
        "component.class": "/Script/Engine.StaticMeshComponent",
        "component.collision_enabled": "QueryAndPhysics",
        "component.collision_profile": "BlockAll",
        "component.mesh": "Cells/SM_ProjectWorldRoad_cell_1.SM_ProjectWorldRoad_cell_1",
        "component.mobility": "Static",
        "component.overlap_events": "0",
        "component.override_materials": "",
        "component.relative_transform": "t=100000,-100000,0;r=0,0,0,1000000;s=100000,100000,100000",
        "external_package": "1",
        "guid": "7a226a5b-868e-5c9c-e728-7c810bab3577",
        "hlod_layer": "none",
        "label": "ProjectWorld Roads cell_1",
        "name": "ProjectWorld_Road_cell_1",
        "spatially_loaded": "1",
        "tags": "ProjectWorld.Generated.v1,ProjectWorld.Grid=road_grid,ProjectWorld.Road.v1,ProjectWorld.RoadCell=cell_1,ProjectWorld.RoadSemantic=13507010f7d122386ca21ab787bf0ca0e2697c3a19fd671ee1a85eae0403ff05",
        "transform": "t=100000,-100000,0;r=0,0,0,1000000;s=100000,100000,100000"
      }
    },
    {
      "kind": "mesh",
      "key": "Cells/SM_ProjectWorldRoad_cell_0",
      "fields": {
        "body": "present",
        "body_double_sided": "0",
        "body_simple_elements": "0",
        "body_trace": "CTF_UseComplexAsSimple",
        "distance_field": "0",
        "distance_field_resolution_scale": "0",
        "mesh_description": "e6fd6c2c7e974d8c65db5b7bcbe40b3b0922e2947ca2ea52dc96af801855e9bd",
        "nanite": "1",
        "navigation_data": "0",
        "render_lod0": "dfa8c9e33ac45e382eb7ed0f94f1168035b9ba694072cd86b3cd11e66b4767a6",
        "source_models": "1",
        "static_materials": "Road=/Engine/BasicShapes/BasicShapeMaterial.BasicShapeMaterial"
      }
    },
    {
      "kind": "mesh",
      "key": "Cells/SM_ProjectWorldRoad_cell_1",
      "fields": {
        "body": "present",
        "body_double_sided": "0",
        "body_simple_elements": "0",
        "body_trace": "CTF_UseComplexAsSimple",
        "distance_field": "0",
        "distance_field_resolution_scale": "0",
        "mesh_description": "740ac6b685e629f58b0421a4cd46109e90c38426d772b30eebd608230bea37f7",
        "nanite": "1",
        "navigation_data": "0",
        "render_lod0": "2ee7c3be489acfed9920b3e1473a8fe246329469eb969f32ef16ba4f4ea4875c",
        "source_models": "1",
        "static_materials": "Road=/Engine/BasicShapes/BasicShapeMaterial.BasicShapeMaterial"
      }
    }
  ]
}
